{
  "$schema": "https://raw.githubusercontent.com/takemo101/sksync/main/schemas/sksync-lock.schema.json",
  "lockfileVersion": 5,
  "generatedBy": "sksync@0.1.0",
  "generatedAt": "2026-05-17T00:00:00.000Z",
  "root": ".",
  "skills": {
    "example-skill": {
      "source": ".sksync/skills/example-skill",
      "installSource": {
        "type": "git",
        "url": "https://github.com/owner/repo.git",
        "ref": "0123456789abcdef0123456789abcdef01234567",
        "path": "path/to/skills/example-skill"
      },
      "include": ["SKILL.md", "references"],
      "hash": "sha256-placeholder",
      "files": [
        {
          "path": "SKILL.md",
          "hash": "sha256-placeholder"
        }
      ]
    }
  }
}
